5pm Seaside | 5pm Seaside,/en/movie-tiff/movie/14637,"On his 40th birthday, Nikos, a solitary truck driver, arrives on a remote beach. He’s there to meet his former lover, Christos, whom he hasn’t seen since their military days."
All That Remains | All that remains,/en/movie-tiff/movie/14657,"An essay film about separation, drawing on the director’s experience as a child of divorced parents. We observe them in their workspace, as the director narrates the story of their encounter and separation as a natural progression of life, despite the trauma that inevitably follows her."
Are You Okay? | Are Υou Οkay?,/en/movie-tiff/movie/14599,"This bystander story is told through the perspective of a 15-year-old girl, Raquelle, who witnesses her classmate Noah being bullied. When doing the right thing transforms Raquelle from bystander to victim, she finds herself trapped in the same emotional quicksand as her peers. At an age when social acceptance weighs heavy and the stress of social media follows you home, Raquelle and Noah learn that no one can make it through alone. Are You Okay? explores the impact that reaching out can have on someone in crisis."
Bigman | STRIJDER,/en/movie-tiff/movie/14502,"Best friends Dylan and Youssef dream of becoming professional football players. One day, an unexpected event changes everything for Dylan, and he has to come to terms with his new life. He does not want to let go of his dream and is still determined to win the Touzani Cup together with Youssef. Thanks to the help of skater girl Maya (his crush!) he learns to play football in a completely new way. A film about true friendship, not giving up, and striving to win."
Cactus | Κάκτος,/en/movie-tiff/movie/14644,Stavros is trying to connect both with his environment and with himself.
Comedy Queen | Comedy Queen,/en/movie-tiff/movie/14491,"Thirteen-year-old Sasha has decided to become a stand-up comedian. Most of all, she wants to amuse her dad, who cries in the shower when he thinks no one is listening. At home, everything reminds her of her mother, who has passed away. However, Sasha refuses to cry. Secretly, she writes a list of everything she must do to survive her grief: shave off her hair, stop reading books, turn down the world's cutest puppy, and most importantly, become the one and only Comedy Queen."
Dad’s Sneakers | Папині кросівки (Papyni Krosivky),/en/movie-tiff/movie/14593,13-year-old Sasha lives in a boarding school for children deprived of parental care. He is one of the luckiest – a family has finally agreed to adopt him. Today he will move to America forever – but there’s something that won’t let him go.
Daphne | Δάφνη,/en/movie-tiff/movie/14641,"Daphne switches from one sexual partner to the next, but does not seem to be satisfied, at least not with what she thought she needed. How far would she go to feel some affection?"
Dounia and The Princess of Aleppo | Dounia et La Princesse D'Alep,/en/movie-tiff/movie/14533,"A few nigella seeds tucked in the palm of her hand, six-year-old Dounia leaves Aleppo with the Princess of Aleppo’s help and travels towards a new world. A heart-warming animation centered around a little girl bursting with confidence, in herself and in life; an ode to the power of optimism against all odds and hardships."
Gaja’s World – This is My Planet! | Gajin svet 2,/en/movie-tiff/movie/14558,"Fourteen-year-old Gaja, who lives in a separate family, confronts envious classmates, experiences identity theft on a social network, and learns what true friendship means. During holidays, her father takes Gaja and her teenage sister to a camp by the sea, but the vacation has not yet begun. With the assistance of her friend and a police inspector, Gaja rescues the owner of a bar from blackmailers and reunites the family. A modern and dynamic youth romantic comedy with elements of crime fiction, full of humor, emotion, and suspense, tackling common, everyday problems."
Harta | Harta,/en/movie-tiff/movie/14612,"Carmela, a 12-year-old girl, is obliged to meet her father at a family meeting center on the day of her birthday, due to the gender-violence sentence her mother has against him. Α film born as a response to the violence that women experience on an everyday basis, aiming to give a voice to the voiceless."
How I Learned to Fly | Leto kada sam naucila da letim,/en/movie-tiff/movie/14492,"A seemingly boring vacation with two old ladies turns into a life-changing experience for 12-year-old Sofia as she kisses a boy, reunites with her estranged family, and faces mortality on an idyllic island in the Mediterranean."
Hussies | Τσουλάκια,/en/movie-tiff/movie/14652,"A coming-of-age story about two sisters leading their lives in different directions, who are summoned to a night’s call of decision making. In a frantic attempt to truffle out money, they come up against visions of both a traumatic past and a disturbing reality, while realizing how difficult it is for a family to make ends meet."
It’s a Long Road | Όλα είναι δρόμος,/en/movie-tiff/movie/14539,"A film made up of three different stories, each one involving a person who is approaching a critical moment in his life. A Silver Coin on the Lips: While at a dig in Macedonia, an architect, whose son shot himself one year earlier while doing his military service, discovers an unlooted tomb that contains the remains of an officer of the Hellenistic period. The Last of the Lesser Whites: a group of ornithologists go to the Evros River Delta to find, with the help of an elderly game warden, the last lesser white-fronted goose which has sought refuge there. When the goose is shot by a poacher, the game warden will pay him back in his own coin. Vietnam: a middle-aged factory owner, distraught over the fact that his wife has taken the children and left him, ends up at a seamy bouzouki joint in the middle of nowhere, which he proceeds to literally demolish."
KIDDO | KIDDO,/en/movie-tiff/movie/14648,Four adolescents are trapped in a narrative about husbands and wives as they slide toward entropy.
Last Sigh | Τελευταία Πνοή,/en/movie-tiff/movie/14642,A woman is weakened. A man tries to approach her. Both are surrounded by a deadly virus.
Love You More Than Peanut Butter | Love You More Than Peanut Butter,/en/movie-tiff/movie/14653,"In a skate park, a teenager named Charis tries desperately to convince his best friend to go talk to his crush, the hottest skater in the park. But Charis crosses the line and puts their friendship at risk."
Magma | Magma,/en/movie-tiff/movie/14645,A lonely woman on a distant planet. A creature that fell from the sky. A storm is coming.
Not Tomorrow | Όχι αύριο,/en/movie-tiff/movie/14636,"Michalis has barely 24 hours to redefine his life and make up for his close ones. That same night, he meets a girl. He only wishes that the morning never comes."
Pendulus | Pendulus,/en/movie-tiff/movie/14638,"Arbi, 24, is raised in Athens. After the events on the night of the Serbia–Albania football match, Arbi will have to decide whether to attend the wedding of his relatives, whether to claim the girl he likes, and whether he is Albanian or Greek."
Sammer | Σάμμερ,/en/movie-tiff/movie/14654,"Summer ends, and with that, every illusion of reality slowly fades away. What happens if you want to hold on to this illusion no matter what?"
Sun & Shadow | Φωτοευαισθησία,/en/movie-tiff/movie/14656,There was light and it was brutal. The shadows could not heal. The Boy had fallen into sleep. The Girl was recalling and the sand was everywhere.
The Invention of Less,/en/movie-tiff/movie/14597,"Due to global warming, a young polar bear has to leave her home and move to Zurich. Together with other animals, she tries to make a living with casual jobs until she suddenly has an idea that will change the world forever."
tokakis or What’s My Name | tokakis or What’s My Name,/en/movie-tiff/movie/14649,"Thanos Tokakis begins a stand-up comedy tour in the Greek countryside, in order to prove to everyone the great actor he is. On this journey, he confronts the audience which won’t let go of his TV performance; but, most of all, he needs to face himself in the eye, as he's struggling to transcend his limits to reach success. Through the end."
Toxic Magnus | Toxic Magnus,/en/movie-tiff/movie/14640,"Following a years-long intense struggle against his father’s obsession with turning him into a macho man, Magnus makes a failed suicide attempt which will eventually lead him to become a life coach."
Trixes | Trixes,/en/movie-tiff/movie/14655,It’s raining. You are trapped in a hair salon. Are you going to cut your hair or not? Will a haircut cure your melancholy? Visit the website to get the whole TRIXES experience.
Yama | Γιάμα,/en/movie-tiff/movie/14651,Athens is celebrating Independence Day: A girl lights a small fire and tells a small lie about a boy. But small racist lies can easily get out of hand. So do small racist fires.
The Woodcutter Story | Metsurin Tarina,/en/movie-tiff/movie/14676,"Pepe is a kind, loveable woodcutter living in an idyllic small town in Finland. In the span of a couple of days, a series of tragic events gradually destroys his quiet and happy life – but Pepe seems to be fine with it all. As if he held a secret to existence that is hard to grasp...  A battle between hope and despair is unleashed and Pepe’s optimism and goodwill are put to an ultimate test. An unpredictable oddity that tackles familiar tropes, themes, and modes of Nordic cinema, only to deliver a deeply melancholic, but utterly satisfying piece of muted, comic surrealism. A film which, in the words of the filmmaker, raises an important question: “What is hope in our world full of destruction and cynical approaches?” This can only be answered by a kind of cinema that is “metaphorical, open and profoundly layered in meaning.”"
A Matter of Trust | Ingen kender dagen,/en/movie-tiff/movie/14490,"Five individuals located five different places in the country and living five different and unique lives. Over the course of 24 hours, they will each face one of life’s defining and crucial crossroads. An unfaithful husband, a doctor struggling with her moral character, a newlywed and pregnant woman, a young student searching for an identity, and a seven-year-old daughter – they will all risk the most vulnerable aspect of life: trust. But trust is under attack, and the consequences will be fatal, forbidden and embarrassingly amusing."
"Hot in Day, Cold at Night | Najeneun deopgo bameneun chupgo",/en/movie-tiff/movie/14669,"A young couple is having a hard time because of their poor circumstances. They are both desperately searching for work, but that is not easy, either. Meanwhile, the husband is about to lose the camera he has lent to his acquaintance, and the wife is cornered after borrowing private loans to take care of the household. Under the circumstances, something ugly will likely happen or come to a dead-end, but the film deals with this predicament with a completely unexpected attitude and wit. The couple’s conversation, facial expressions, movements, and postures, as well as the illumination and density of the screen that captures them, simultaneously create bizarre humor and lonesome emotions, absorbing the audience. Hot in Day, Cold at Night is a rare moral comedy that comforts the daily lives of poverty with a strange touch of laughter. In the last scene, the husband’s helpless giving up finally moves us. (Film at Lincoln Center)"
The Ballad of Crowfoot | The Ballad of Crowfoot,/en/movie-tiff/movie/14582,"In the acclaimed The Ballad of Crowfoot by Willie Dunn, a dynamic editing juxtaposes archival photos with Dunn’s ballad. This heart-wrenching and painful mix of music and image unfolds the story of both Canada’s indigenous people and Crowfoot, the legendary chief of the Blackfeet tribe."
The Exiles | The Exiles,/en/movie-tiff/movie/14543,"One of the most legendary and underseen masterpieces in the history of cinema revolves around a group of young indigenous Americans, living in LA’s Bunker Hill. Yvonne, a pregnant Apache woman, and Homer, her Hualapai husband, share their tiny flat with Tony, a gifted Mexican, and four native women. At night, when men go out on a drinking, gambling and flirting spree, Yvonne goes to the movies all by herself or roams in the streets, oozing a repressed yearning. The film’s documentary-like black and white frames capture fragments of life in the metropolis, depicting snapshots from a dislocated generation, torn between its origins and the bleak everyday life of the contemporary urban landscape."
When All the Leaves are Gone | When All the Leaves are Gone,/en/movie-tiff/movie/14583,"In When All the Leaves Are Gone, the central heroine is the sole indigenous student in an all-white school, during the 1940s. The eight-year-old girl is aware of the hostile atmosphere around her, which will transform into proper bullying when excerpts from a history book that represent indigenous people as boors and barbarians, are read aloud in class. All alone in her own hell, she finds relief and strength within the protected world of her magic dreams. Inspired by the director and screenwriter’s personal experiences, When All the Leaves Are Gone combines autobiographical elements, fiction and legends, to interweave a moving story about self-rejection and the redeeming power of imagination."
Vera | Vera,/en/movie-tiff/movie/14704,"Vera lives in the shadow of her famous father. Tired of her superficial life and relationships, she drifts through Roman high society. When she injures a child in a traffic accident in the suburbs, she forms an intense relationship with an eight-year-old boy and his father. But soon she must realize that also in this world she is only an instrument for others."
The Cow Who Sang a Song Into The Future | La vaca que cantó una canción sobre el futuro,/en/movie-tiff/movie/14462,"In this mystical exploration of family relationships and fragile environments, magic realism meets ecological absurdism. When thousands of fish die in a polluted river in southern Chile, Magdalena, a woman long-deceased, emerges amongst their lifeless bodies. Magdalena encounters her widowed husband, sending him into a state of shock and prompting the return of their daughter, Cecilia. Magdalena’s presence and her effect on the environment stir curiosity and fear among her family. As the past comes into focus, mother and daughter are met with the opportunity to change the future. A beautifully eerie and resonant tale about motherhood and the natural world, a magical spell that encourages introspection while keeping us on our toes till the very end. The possibility of resurrection and healing emerges from a chorus of aquatic and bovine voices."
The Last Queen | La Dernière reine,/en/movie-tiff/movie/14572,"An unknown facet of Mediterranean history is narrated through a strong female perspective, in a vivid portrait of a heroine from the past that inspires the future. Algeria, 1516. The pirate Aruj Barbarossa frees this land from the tyranny of the Spanish and seizes power over the kingdom. Rumor has it he murdered King Salim Toumi, despite their alliance. Against all odds, one woman will stand up to him: Queen Zaphira. Between history and legend, this woman’s journey tells of a struggle, of personal and political turmoil endured for the sake of a bigger cause."
And Love Has Vanished | Dvoje,/en/movie-tiff/movie/14565,"A romantic encounter. Love. The end of a relationship and the death of a feeling. Alexander Petrović examines the chaos and romance of a couple in an intimate and poetic way. In this work, he revolutionizes the language of cinematography."
Tell me Lies (A Film about London) | Tell me Lies (A Film about London),/en/movie-tiff/movie/14639,"An essential film balancing many different tones and registers, and gaining a whole different sense of timeliness in our turbulent times, which might be read as Brook’s love letter to his craft and his country. “Subtitled A Film About London, this drama is a quintessential experimental counter-culture film of the late 1960s that centers on the questions raised by the Vietnam war. Renowned Shakespearean theater director Peter Brook serves as producer and director. It includes many members of the Royal Shakespeare Company ... [who] become obsessed with a photograph of a wounded Vietnamese child and begin discussing the war with their friends and fellow actors... The discussions are combined with newsreel footage in a bizarre collage of images. Moved to do something, the group of actors puts on a series of skits about the war.” (Michael Betzold, The New York Times)."
Sons of Ramses | Goutte D'Or,/en/movie-tiff/movie/14530,"Ramses is a skillful clairvoyant in the multicultural Parisian district of La Goutte d’Or. When a gang of fearless kids start terrorizing the locals, the balance of his thriving business and of the whole neighborhood is disturbed. Until one day, when Ramses has a real vision... Combining supernatural and criminal elements alike as cover to sneak deeper into this vibrant, little-known community, the awarded director tells a thrilling and moving urban tale that questions themes of belief and blood ties."
The Line | La ligne,/en/movie-tiff/movie/14482,"After a violent argument with her mother, Margaret, 35 years old and with a long history of inflicting and suffering from violence, is subject to a strict restraining order before her trial: she’s no longer allowed to make contact with her mother or approach within 100 meters of the family home for three months. But this separation only exacerbates her desire to be closer to her family and so she returns every day to this invisible and impassable frontier."
The Fabelmans | The Fabelmans,/en/movie-tiff/movie/14726,"Steven Spielberg’s most personal film yet is based on the director’s reflection on the experiences that made him the filmmaker we know and love, in a story based on his childhood in Arizona. Instead of chasing sharks or running from giant boulders, Spielberg has Sammy navigating the interpersonal landmines of home and school life, in what may be the most emotionally expansive film of his career. Starting with gunslingers and war stories, the way any Boy Scout in the late 1950s might, Sammy/Spielberg shows us not only what sparked Spielberg’s love for cinema, but also how empathy and human relationships have sneaked their way into the work of this master filmmaker."
"Before, Now & Then | Nana",/en/movie-tiff/movie/14664,"The film follows different stages in the life of Nana, a gentle and beautiful woman who finds herself entangled in the political turmoil of 1960s Indonesia. Several years later, she escapes poverty through a second marriage to a wealthy Sundanese man. While past memories and the trauma of war continue to haunt her, she begins to question the patriarchal social dictates of her time alongside Ino, her new husband's mistress. In this subtle and emotionally nuanced film, female solidarity and friendship take center stage as Kamila Andini delivers a fascinating portrait of Indonesia’s political past, domestic life and gender dynamics."
Rodeo,/en/movie-tiff/movie/14503,"Since the 2005 uprisings, the Parisian suburbs keep reminding us of the fierce class conflicts and ethnic controversies that characterize the not-so-uniform French territory. After spending years in an underground biker community north of Paris, Lola Quivoron draws on her own personal experience to tell the story of Julia, a hot-tempered and fiercely independent female rider who finds escape in her passion for motorcycles and the fast-paced world of urban “rodeos” – illicit gatherings where bikers show off their bikes and their latest daring stunts. In a film where motorcycles become mechanical horses of a contemporary western, Rodeo explores the female condition in a male-dominated world from a fresh perspective and, at the same time, reveals harsh social realities that fuel conflict."
Somewhere over the Chemtrails | Kdyby Radši Hořelo,/en/movie-tiff/movie/14478,"Standa and Bronya are volunteer firefighters in a small village. While the clumsy Standa is looking forward to the birth of his son soon, his older friend Bronya is no longer enjoying life because his wife has recently died. Things begin to change when a van crashes into a crowd of people during the Easter Fair. Before anyone notices, the driver runs away from the car crash. People believe it is a terrorist attack and the festive mood is replaced by an atmosphere of fear, hatred, and misinformation, into which the locals sink. Bronya, who is convinced of terrorism, is trying to do something to improve the situation. The sense of danger pumps new blood into his veins, and the fire brigade becomes a militia."
Samson & Delilah | Samson & Delilah,/en/movie-tiff/movie/14584,"Warwick Thornton’s Samson & Delilah showcases a sensitive and unconventional love story between two teenage Aboriginals, in the desert of Australia’s inner land, embarking on a survival journey full of hardships. Their tacit – but eloquent in meanings – odyssey reflects the fragile nature of youth, which strives to survive in an environment governed by violent marginalization, lack of prospects, and discrimination. Through scarce dialogues, the resourceful use of expressive means and the spot-on guidance of the amateur cast, the director weaves an unrefined and rough love story that is at once humane and tender."
Incredible but True | Incroyable mais vrai,/en/movie-tiff/movie/14485,"Alain and Marie move to a quiet suburb. A mysterious tunnel in the cellar of their new home will turn their lives upside down... A unique, idiosyncratic, delightful comedy that reveals the endless surprises hidden in the most mundane confined spaces, through a mind-blowing journey in time."
A Νight at the Theater | Μια νύχτα στο θέατρο,/en/movie-tiff/movie/14549,"Two hundred years after the Greek Revolution, a coup d’état is underway in Greece. A man named Odysseus hides in a theater for three days. On the third night, a woman named Athena finds him in his shelter. As the night passes by, they slowly transform into the mythological characters of the same name."
Rebel,/en/movie-tiff/movie/14515,"When Kamal resolves to change his life for the better, he leaves Belgium to help war victims in Syria. But, having arrived, he is forced to join a militia and is left stranded in Raqqa. Back home, his younger brother Nassim quickly becomes easy prey for radical recruiters, who promise to reunite him with his brother. Their mother, Leila, fights to protect the only thing she has left: her youngest son. Violent, lyrical, poetic, and urgent: this is a film rebelling with a cause."
Piggy | Cerdita,/en/movie-tiff/movie/14487,"With the summer sun beating down on her rural Spanish town, Sara hides away in her parent’s butcher shop. A teenager whose excess weight makes her the target of incessant bullying, she flees a clique of capricious girls who torment her at the town pool, only to stumble upon them being brutally kidnapped by a stranger, who drives off with them in his van. When the police begin asking questions, Sara keeps quiet. Intrigued by the stranger – an interest that’s mutual – she’s torn between revealing the truth and protecting the man who saved her. A harrowing genre exploration of bullying, internalized trauma, revenge, and desire."
We Might As Well Be Dead | Wir könnten genauso gut tot sein,/en/movie-tiff/movie/14672,"It may only be a tower block on the edge of a forest, but you can tell by the look on the faces of the people hoping to join the building’s community that this must be one of the last bastions of civilisation in a world that has fallen apart. To live here, shielded from a dangerous environment, is the goal. But when the caretaker’s dog disappears, an irrational fear spreads among the residents. Security officer Anna makes an appeal for reason and begins to search for the animal. Meanwhile, her daughter Iris locks herself in the bathroom. She is convinced that, with her “evil eye,” she herself is responsible for the dog’s disappearance. When a newly formed vigilante group demands stricter security measures and a renewed suitability test for the entire community, Anna begins to fear for her right to stay."
The Orator | O Le Tulafale,/en/movie-tiff/movie/14504,"Shot exclusively on the Island of Upolu in Samoa and in the local language, The Orator constructs a moving drama about courage, forgiveness and love. The leader of the story is Saili, who lives a simple and humble life with his beloved wife and their daughter, in a remote, traditional village. Forced to protect his land and family, Saili has to overcome his fears and find the courage to defend his loved ones."
