Seven Songs from the Tundra | Seitsemän laulua tundralta,/en/movie-tiff/movie/14506,"Seven Songs of the Tundra takes place amidst the infinite white tundra, where a small religious cult sacrifices a reindeer. A ceremonial song accompanies the sacrifice, triggering a narrative divided into seven chapters, which re-enacts a pivotal point in the Nenets natives’ history. Deprived of their independence and prosperity, the nomadic reindeer breeders were ostracized from their homeland and asked to abandon not only their language and traditions but also their children that were forced to enroll in boarding schools. Bordering on the threshold between documentary and fiction, the first movie ever to be shot in the Nenets language is a touching drama that explores the deep wounds inflicted by the loss of identity and the struggle for survival."
My Emptiness and I | Mi vacío y yo,/en/movie-tiff/movie/14463,"Raphi is young, androgynous, and naive. In Barcelona, she begins a gender transition as well as an arduous journey to find her true identity. We follow this brace trans woman during this essential, if confusing, period of metamorphosis: We see her in her everyday life, as she talks candidly with colleagues, queer friends, and the men she meets through apps. Despite all the advice she receives, it turns out that it is mostly time and experience that will help her embrace her place in this world. Created in response to an urge (or the urgency) to portray the life of trans people in the first person – not only making them participants in the project, but placing them at the core of the creative process, becoming active subjects, and not objects of representation – this delicate, emotionally intelligent feature shot by the director of Sediments (Special Jury Prize at the 2021 Thessaloniki Documentary Festival) reformulates the ever-timely issues of identity politics and inclusion."
Blue Jean,/en/movie-tiff/movie/14706,"England, 1988. Margaret Thatcher’s Conservative government has introduced Section 28, a clause of the Local Government Act which seeks to prohibit “the promotion of homosexuality” by local authorities across the United Kingdom. For Jean, a gym teacher whose sexuality is a secret from her colleagues, the threat is immediate and real: if exposed, her love life could cost her her job. At work, every sidelong glance, every whisper, and every query about Jean’s private life is a threat. But sympathy from her girlfriend Viv, also feels limited. Out and proud, and part of a cooperative of similarly assertive lesbian women, Viv regards secrecy as a capitulation to an increasingly oppressive system. As pressure mounts from all sides, the arrival of a new girl at school catalyses a crisis that will challenge Jean to her core. Anchored by a stunning performance from Rosy McEwen, this poised and penetrating debut of Georgia Oakley grips like a thriller, whilst exploring with intense sensitivity a period in British history the effects of which still resonate in countless lives today."
Next Sohee | Da-Eum-So-Hee,/en/movie-tiff/movie/14537,"When an intelligent and discreet police detective is assigned to investigate the death of a high school student she knew from their mutual dance class, a nightmarish journey begins. As the detective unravels the dark events of the girl’s past and her harsh working conditions, the investigation takes an emotional turn and the once-composed professional begins to boil with rage. A mature sophomore film offers a chilling insight into the exploitation of unpaid internships, a contemporary network of silent enablers, and the horror of being alone in a hostile world."
A Metaphysical Education | A Metaphysical Education,/en/movie-tiff/movie/14595,"A champion runner finds himself torn between winning a race and compulsively amassing any object he finds on his way. The film came about from a workshop run by Balázs Lóth in Budapest called Celluloid Műhely. Each participant was given complete freedom to make anything as long as the production didn’t exceed one roll of 16mm film, which was donated by the workshop."
Berberian Sound Studio | Berberian Sound Studio,/en/movie-tiff/movie/14510,"1976: Berberian Sound Studio is one of the cheapest, sleaziest post-production studios in Italy. Only the most sordid horror films have their sound processed and sharpened in this studio. Gilderoy, a naive and introverted sound engineer from England is hired to orchestrate the sound mix for the latest film by horror maestro, Santini. Thrown from the innocent world of local documentaries into a foreign environment fuelled by exploitation, Gilderoy soon finds himself caught up in a forbidding world of bitter actresses, capricious technicians and confounding bureaucracy. The longer Gilderoy spends mixing screams and the bloodcurdling sounds of hacked vegetables, the more homesick he becomes for his garden shed studio in his hometown of Dorking. His mother’s letters alternate between banal gossip and an ominous hysteria, which gradually mirrors the black magic of Santini’s film. As both time and realities shift, Gilderoy finds himself lost in an otherworldly spiral of sonic and personal mayhem, and has to confront his own demons in order to stay afloat in an environment ruled by exploitation both on and off screen."
Berberian Sound Studio (short version) | Berberian Sound Studio (short version),/en/movie-tiff/movie/14596,"Two foley artists make sound effects for a cheap B-movie. A teaser (or perhaps appetizer) for Peter Strickland’s masterpiece, manages to contain his intoxicating, immersive universe in one single minute."
Tommy Guns | Nação Valente,/en/movie-tiff/movie/14580,"In 1974, after years of civil war, the Portuguese and their descendants fled the colony of Angola where independentist groups gradually claimed their territory back. While a tribal girl discovers love and death when her path crosses that of a young Portuguese soldier, a group of Portuguese soldiers barracked inside an infinite wall are called to escape once the past comes out of the grave to claim its long-awaited justice. Borrowing its original title from the lyrics of Portugal’s national anthem, this visually arresting and uncompromising film is at once a relentless study of colonialism and a parable of the devastation of warfare. Blending genres and tones, this imagi-nation in chiaroscuro is an ode to male beauty and mortality, vaguely alluding to the quasi-metaphysical cinema of Pedro Costa."
Broadway | Broadway,/en/movie-tiff/movie/14629,"Nelly has escaped from her wealthy and controlling family. As she dances in a strip club, she meets Markos, a charismatic gangster, who helps her run away from her stepfather’s henchmen. Markos becomes her protector and lover. He brings her into Broadway, an abandoned entertainment complex squatted by a community of dancers, tramps and thieves."
Silence 6-9 | Ησυχία 6-9,/en/movie-tiff/movie/14628,"Aris and Anna meet one evening in a half-abandoned, coastal town, which is surrounded by antennas; the antennas emit strange sounds and enable the transmission of the voices of the Lost Ones – inhabitants who have suddenly and inexplicably disappeared. In this strange world, Aris and Anna fall in love. A few days later, Anna disappears."
Fools | Głupcy,/en/movie-tiff/movie/14499,"Marlena (62) and Tomasz (42), hidden away from the world in a small seaside town, have been in a happy relationship for many years. Their intricately woven everyday life slowly begins to crumble when, against Tomasz’s will, Marlena allows her son to move in with them. As the past comes back to them in full force they will have to redefine their love, choices and life."
Iman | Iman,/en/movie-tiff/movie/14631,"Abdallah, an Arab Muslim civil engineer, has to come to terms with his own responsibility in the collapse of a building, which caused the death of 7 people. Having been radicalized, Iman and Leila, are sent to Cyprus on a secret mission. Michelle, a lonely teenager falls for Angelos, a domineering young man with racist beliefs. Three stories, each involving characters whose actions mark the difference between life and death, are defined by their search for redemption."
Men of Deeds | Oameni de treabă,/en/movie-tiff/movie/14518,"Ilie, a small-town police chief, wants to build a modest, comfortable life for himself, but ends up making the wrong choices. Middle-aged and alienated, he feels the need to be a part of something – to build an orchard, even a home. Although dubious things happen in the village, Ilie only sees what suits him. The moment he gets involved in the village marks the beginning of his collapse. In a vacuum of solutions, he tries to be what he has never been before: the justice seeker who arrests everyone guilty. A nuanced, ironic, exploration of the foundations of toxic masculinity and the inability (or unwillingness) to fit the traditional social standards, featuring one of the best performances in contemporary Romanian cinema."
Godland | Vanskabte Land - Volaða Land,/en/movie-tiff/movie/14677,"At the end of the 19th century, a young Danish priest travels to a remote part of Iceland to build a church and to photograph its people. But the deeper he penetrates into the inner of this imposing place, the further away he diverts from his purpose, his mission and his morals. One of the most sensational films that premiered in this year's Cannes (Un Certain Regard competition), the mystic Godland by Icelander Hlynur Pálmason, poses every huge supernatural and existential question (human's place within nature and the universe, faith and fear of God, the quest for what connects us with the Other, reconciliation with death as a means of overcoming agony), utilizing an impressive film discourse that reminds us from Terrence Malick to Dreyer and Bergman, and from (the similarly thematic) Silence by Martin Scorcese to the magnificent Calvary by John Michael McDonaugh. A film experience that one more so lives through than merely watches, but made for the big screen, despite its overall magnitude."
Blank Narcissus (Passion of the Swamp) | Blank Narcissus (Passion of the Swamp),/en/movie-tiff/movie/14592,"An aging porno director (played by Michael Brandon from Dario Argento’s Four Flies on Grey Velvet) makes a commentary in 2022 for the DVD of an underground 16mm film he made in 1972 and was recently rediscovered. As the beautiful stud in the film undergoes a series of erotic reveries, the director laments his doomed love affair with his protagonist."
Flux Gourmet | Flux Gourmet,/en/movie-tiff/movie/14475,"Peter Strickland’s fifth feature takes place in an art residency led by an upper-class aesthete who has invited a culinary collective to perform their “sonic catering” practice for a month. Hired to report on their creative process, a Greek writer begins to suffer from indigestion, to which the institution’s sarcastic doctor responds by advising him to “let food be his medicine.” While his intestinal disorders force him to acknowledge his own malaise, the collective is undermined by internal quarrels as well as external assaults from a group of sardonic, rejected candidates. Strickland’s gory comedy reconnects the image with those organic processes that art usually deems to be impure and unacceptable. Not as a provocation, but to remind us that the imagination should not be seen as separate from the natural realm."
Paris is in Harlem | Paris is in Harlem,/en/movie-tiff/movie/14727,"On the eve of New York City’s controversial “No Dancing” Law getting repealed, the lives of several strangers are forever changed by a shooting at a historic jazz bar in Harlem. Paris is in Harlem is a symphonic story devoted to the song which is America today – a song of separation, division, and confusion. A world failed by words, a world where only music can transport us to a place where “everything’s gonna be alright.”"
Will-o'-the-Wisp | Fogo-Fátuo,/en/movie-tiff/movie/14680,"On his deathbed, his royal highness Alfredo, a king without a crown, reminisces about his youth and the time when he dreamed of becoming an “ordinary” fireman. The encounter with instructor Afonso, a young black man/dancer from the fire brigade, opens a new chapter in the lives of the two young men, who dive deep into love and desire with the will to change the status quo. One of the most idiosyncratic directors of our time revisits the musical comedy genre only to experiment with its limits. João Pedro Rodrigues embraces social and cinematographic stereotypes and twists them in new directions. The result is a fresh and witty film, full of love, both romantic and physical, music, and theatre."
I Even Met Happy Gypsies | Skupljači Perja,/en/movie-tiff/movie/14563,"Bora the Gypsy is married to an older woman, and he falls in love with the younger Tissa, who is being offered in marriage by her father, to a young gypsy man. This marriage arrangement is according to custom. Tissa rejects her husband, claiming he is not able to consummate the marriage, and Bora joins her. They get a monk in the mountains to marry them. Unable to return to the Gypsy camp, Tissa tries to reach Belgrade on her own, but a couple of truck drivers rape her, so she does return in misery to her tribe. Meanwhile, Bora defends his honor the traditional way, in a knife duel, and kills his opponent. Therefore he, too, must leave the tribe. And yet, we’ll find happy gypsies..."
To the North | Spre Nord,/en/movie-tiff/movie/14566,"1996, open sea. During his shift on a transatlantic ship’s deck, Joel, a religious Filipino sailor, discovers Dumitru, a Romanian stowaway hidden between some containers. If he is spotted by the Taiwanese officers running the vessel, Dumitru is at risk to be thrown overboard. Joel decides to hide him, as a sign of his gratitude toward God. Soon, a dangerous cat and mouse game begins. When his crew, his own friends, and even God himself start to turn their backs on him, Joel learns that he has to face his cruel destiny alone. Inspired by a true story and first formulated as a radio documentary, this is a story – in the words of its own creator – “about moral choices, kindness and compromise, courage and fear. A film that could speak to people about their own lives.”"
Under the Fig Trees,/en/movie-tiff/movie/14687,"Among the trees, young women and men working the summer harvest develop new feelings, flirt, try to understand each other, find – and flee – deeper connections. An engaging depiction of summer flirtations and gentle exploration of sisterhood, shot in a vibrant, “enclosed” open-air space, without scripted dialogue, but full of flavors, scents, and textures."
It Rains in my Village | Biće skoro propast sveta,/en/movie-tiff/movie/14562,"In a Vojvodinian village, the owner of a café is in conflict with a hog dealer. In order to get revenge, the owner and his friends persuade the half-drunk hog dealer to marry the village jester. In the meantime, a young teacher comes to town and the hog dealer falls in love with her. Thinking his wife now bothers him, he decides to murder her..."
A Little Love Package,/en/movie-tiff/movie/14484,"Vienna, 2019 – the end of an era. The smoking ban in public places means that a part of Kaffeehaus culture has disappeared. Of all moments, this is the one that Angeliki (impersonated by terrific Angeliki Papoulia) chooses to buy an apartment with help from her interior designer friend, Carmen. Angeliki seems to have something against all of them: either the parquet floors creak, the tiles are the wrong color or she is bothered by the proximity to a restaurant. How will she ever find a new home in this environment? Carmen feels like she’s talking to a brick wall. Moreover, she simply cannot understand why Angeliki is refusing to part with her money. Journeying from Vienna to Andalusia, via salt flats overcast by mysterious shadows, Gastón Solnicki’s fifth feature film is a brilliant lesson in generosity. A classic comedy dominated by women, which brings together actors and non-actors in a lively, fragmented story – a subtle and witty homage to one of the most photogenic capitals of Europe, which discovers bygone splendor in ordinary things."
"The Taste of Apples Is Red | Ta'am al Tufah, Ahmar",/en/movie-tiff/movie/14708,"Kamel has spent his entire life in a small village in the Golan Heights, not far from the Syrian border. He becomes a respected religious leader. The troubles of his early life seem long gone, despite the war tearing the country apart. One night, a light knock on the door changes everything. Kamel's younger brother, Mustafa, shows up wounded 50 years after disappearing across the border. Kamel must now must make an impossible decision between family and duty."
The Dam | Le Barrage,/en/movie-tiff/movie/14685,"Sudan, near the Merowe dam. Maher works in a traditional brickyard fed by the waters of the Nile. Every evening, he secretly wanders off into the desert to build a mysterious construction made of mud. While the Sudanese people rise to claim their freedom, his creation starts to take a life of its own… Part of a larger project devoted to the landscapes and expansive geographies of violence, this chilling, imposing film identifies how violent crises are rendered invisible in particular environments, and makes tangibles how political, social and geopolitical events are embedded in the most surprising places."
The Magic Glass | Το μαγικό γυαλί,/en/movie-tiff/movie/14575,"Through a seemingly light-hearted approach to depicting different minor incidents in a married couple’s everyday life, the film tackles their fragile relationship, which is threatened from both the inside and the outside."
Suro | Suro,/en/movie-tiff/movie/14550,"Elena and Ivan are about to embark on a new chapter in their lives. They are leaving the megacity of Barcelona and moving to rural Catalonia to take over a cork oak plantation. Their cork business is not only to provide them with a new livelihood, but it is also to be run fairly and sustainably. With all their ideals, Elena and Ivan come up against a harsh reality: City, country, desire, reality and gender roles all collide. And the two are soon heading for a crisis that will not only test their joint project, but also their entire relationship. Created with a light touch, the film uses the subtle hints and meaningful glances of its characters to tell of the balance of power in a modern relationship."
Travelling Ghosts | Fantasmata tis Epanastasis,/en/movie-tiff/movie/14627,"Α Greek filmmaker finds himself in Trieste, where he plans to make a documentary following the footsteps of the Greek revolutionary intellectual Rìgas Feràios. While visiting the Greek Orthodox cemetery, a group of ghosts from the 18th century cross his path. A modern comedy based on real historic events."
Nocebo,/en/movie-tiff/movie/14661,"Irish filmmaker Lorcan Finnegan is proving himself to be a master manipulator of benign space, turning the familiar or domestic into a nightmarish labyrinth of horror. An affluent home becomes the setting for an intense showdown between a successful woman and that which haunts her. A fashion designer suffers from a mysterious illness that confounds her doctors and frustrates her husband – until help arrives in the form of a Filipino nanny who uses traditional folk healing to reveal a horrifying truth. Starring Eva Green and Mark Strong, Nocebo (which means a negative placebo effect) combines traditional folklore with modern concerns about cultural exploitation and, via moments of melodramatic grandeur, proves to be an intriguing work from one of Ireland’s most interesting talents."
The eight mountains | Le Otto Montagne,/en/movie-tiff/movie/14700,"The Eight Mountains is the story of a friendship. Of children becoming men who try to erase the footprints of their fathers, but who, through the twists and turns they take, always end up returning home. Pietro is a boy from the city, Bruno is the last child of a forgotten mountain village. Over the years Bruno remains faithful to his mountain, while Pietro is the one who comes and goes. Their encounters introduce them to love and loss, reminding them of their origins, and letting their destinies unfold, as Pietro and Bruno discover what it means to be true friends for life."
The Happiest Man in the World | Najsreќniot Čovek na Svetot,/en/movie-tiff/movie/14613,"Asja, a 40-year-old single woman living in Sarajevo, is looking for love. Trying out intensive methods to meet new people and encouraged by her mother, she joins a speed dating event, where she is matched with Zoran, a 43-year-old banker. But despite their seemingly successful pairing, their haunting past returns to prove that the two of them were once found on opposite battlefields and that Zoran is in search of redemption rather than a romantic affair. Armed with a brilliant cast of characters and a penetrating script, this visually arresting investigation into the continuation of life in the aftermath of war, manages to present the devastating history of the Balkans in a contained, complex fashion; but most of all, the film delivers a captivating, eternal message about the soul power released through the unearthing of buried feelings."
Cold Meridian | Cold Meridian,/en/movie-tiff/movie/14511,"Autonomous Sensory meridian response (ASMR), which has grown to become a YouTube sensation, can be defined as the tingling sensation on our scalp, cervix, and upper spine, followed by a feeling of slight euphoria and relaxation. In this entrancing short film, a series of repeated ASMR rituals immerse us in a hallucinatory and hovering world. Within this dreamlike and voyeuristic maelstrom, all certainties seem to take the form of distorted fantasies."
In Fabric | In Fabric,/en/movie-tiff/movie/14517,"A haunting ghost story set against the backdrop of a busy winter sales period in a department store that follows the life of a cursed dress as it passes from person to person, with devastating consequences."
Living,/en/movie-tiff/movie/14662,"An adaptation of Akira Kurosawa's 1952 classic Ikiru by Nobel & Booker Prize winner Kazuo Ishiguro. This is a film about how a small but epic act can become a momentous event. In London 1952, Williams, a veteran civil servant, has become a small cog in the bureaucracy of rebuilding post-WWII England. As endless paperwork piles up on his desk, he learns he has a fatal illness. Thus begins his quest to find some meaning to his life before it slips away."
Peter von Kant,/en/movie-tiff/movie/14712,"Peter Von Kant, a successful, famous director, lives with his assistant Karl, whom he likes to mistreat and humiliate. Through the great actress Sidonie, he meets and falls in love with Amir, a handsome young man of modest means. He offers to share his apartment and help Amir break into the world of cinema…"
Convenience Store | Produkty 24,/en/movie-tiff/movie/14481,"A supermarket in a Moscow suburb is the heart of darkness for the Uzbek “employees” who work there around the clock and are threatened, abused, and imprisoned. Mukhabbat, like the rest of the immigrants at the store, is a young woman forced to work without getting paid and to endure mental and physical abuse, until the day she overcomes her fear and takes her fate into her own hands... Based on true events and active legal cases of immigrants in Russia, the film captures the terrible aspects of modern slavery in a visceral blend of realism, documentary-style elements, and grand-scale cinema."
Sick of Myself,/en/movie-tiff/movie/14682,"Signe and Thomas are in an unhealthy, competitive relationship that takes a vicious turn when Thomas suddenly breaks through as a contemporary artist. In response, Signe makes a desperate attempt to regain her status by creating a new persona hell-bent on attracting attention and sympathy. a film about a dysfunctional, toxic relationship – an ‘anti-rom-com’ destined to be influential, is a scathing portrait of nihilistic narcissism that taps into similar deadpan humor but walks a much more precarious tightrope between uncomfortable satire and plain cruelty."
Pornomelancolía | Pornomelancolía,/en/movie-tiff/movie/14535,"Lalo is a sex-influencer: He posts photos of his naked body and homemade porn videos for his thousands of followers on social networks. Lalo directs his own life, but in private, out of character, he seems to live in a permanent melancholy. Where does desire go when life turns into a sex show? A film that takes pornography as a starting point to reflect on the relationship between sexuality and work, on being public and feeling lonely, on the characters we build of ourselves to show ourselves (or hide) from the world."
Ashkal,/en/movie-tiff/movie/14528,"In the Gardens of Carthage, a district of Tunis initiated by the former Regime which construction stopped at the beginning of the Revolution, two cops, Fatma and Batal, find a burnt body in one of the lots. As construction slowly resumes, they start looking into this mysterious case. When the event repeats itself, the investigation takes a puzzling turn."
