L’ Arrivée | L’ Arrivée,/en/movie-tiff/movie/14622,"Although by no means a conventional narrative, and certainly a film inspired by the avant-garde’s simultaneous engagement with formal abstraction and material energy, L’Arrivée also engages with the history and form of narrative cinema. Certainly, its role in that relation is a critical one, revealing both the mechanism and the material that commercial cinema strives to conceal. But while engaged in a process of deconstruction, L’Arrivée also recognizes the power of cinema, utilizing its control over space, and in this film especially, time, in order to uncover the energies of motion and story, of the violence inherent in both revolt and containment. (Tom Gunning)"
Outer Space | Outer Space,/en/movie-tiff/movie/14623,"A woman, terrorized by an invisible and aggressive force, is also exposed to the audience’s gaze, a prisoner in two senses. Outer Space agitates this construction, which is prototypical for gender hierarchies and classic cinema’s viewing regime, and allows the protagonist to turn them upside down. (…) The story ends in the woman’s resistant gaze. (Isabella Reicher)"
Train Again | Train Again,/en/movie-tiff/movie/14626,"18 years after Kurt Kren produced his third film 3/60 Bäume im Herbst [3/60 Trees in Autumn], he shot his masterpiece 37/78 Tree Again. 18 years after I created my third darkroom film L’Arrivée (an homage to the Lumière brothers and their 1895 L'Arrivée d'un train), I embarked on Train Again. This third film in my “Rushes Series” is an homage to Kurt Kren that simultaneously taps into a classic motif in film history. My darkroom ride took a few years, but we finally arrived: All aboard!
(Peter Tscherkassky)"
Rounding | Rounding,/en/movie-tiff/movie/14532,"After treating an older patient near the end of her life and collapsing, a young resident doctor is transferred to a rural hospital in Greenville for a fresh start. Having trouble connecting with patients, his superior urges him to be more personable and take a “Bedside Technique” class. When James becomes consumed with the case of a young asthma patient, demons from his past begin haunting him: As an injured ankle flares up, James is confronted with hospital bureaucracy, his nightmares magnify his anxiety, and his reality starts to unravel."
A Day in the Life of a Teddy Bear | A Day in the Life of a Teddy Bear,/en/movie-tiff/movie/14633,"A boy-meets-girl-meets-teddy bear story, taking place in Shanghai. Jinxi is a violinist, about to fulfill her dream of moving to Vienna to continue with her music studies. While trying to settle her affairs before departing, her encounter with Panos, a Greek architect newly arrived in Shanghai, will have a disrupting effect on her life."
LOLA,/en/movie-tiff/movie/14523,"What if David Bowie’s Space Oddity could be listened to back in 1941? That’s just one of many questions raised by LOLA, a film true to science fiction's key preoccupation with technology, its promises of infinite prosperity, and its destructive consequences. With striking black-and-white imagery and 16mm shots that feel all-too authentic, the film delves into an alternative timeline where sisters Thom and Mars invent a machine that can intercept radio and TV broadcasts from the future. When World War II breaks out, ethics clash with responsibility as the sisters must now decide how to use their knowledge – known to be the ultimate form of power."
Butterfly Vision | Bachennya metelyka,/en/movie-tiff/movie/14514,"Moving away from typical glorious and patriotic (male) war stories, Buttefly Vision focuses on the condition of female soldiers who may have to face things worse than death. After spending months as a prisoner in Donbas, Ukrainian aerial reconnaissance expert Lilia returns home to her family. However, memories and feelings from her past captivity continue to torment her and resurface in dreamlike ways. While unable to forget, Lilia refuses to identify as a victim and instead starts a new struggle, this time to liberate herself. With this film, Maksym Nakonechnyi explores the haunting and often surreal dimensions of individual trauma, that here reflect the collective trauma of a country devasted by war, violence and hatred."
The Uncle | Stric,/en/movie-tiff/movie/14513,"The film appears to be set in the late 1980s Yugoslavia, as a family welcomes their beloved uncle, who has returned home from Germany for the holidays. The reunited family enjoys the Christmas lunch until a smartphone starts ringing. It’s a sign that it is not the 1980s, it’s not quite Christmas time either, and it is not just the served turkey that can be cut with a knife – the tension can too. A sharp chamber thriller that plays an imaginative game challenging the boundaries of truth, representation, and memory of the past."
"My Friend, Lefterakis | Ο φίλος μου, ο Λευτεράκης",/en/movie-tiff/movie/14547,"In his effort to cover his love affairs from his wife, Theodoros has invented Lefterakis – an imaginary friend from Patras. His system seems to work, until, one day, Lefterakis shows up at his doorstep, alive and kicking. Τheodoros loses his mind and tries to convince Lefterakis that he does not… exist."
Mother and Son | Un Petit Frère,/en/movie-tiff/movie/14699,"Set in the late 1980s, this subtly crafted drama unfolds with delicacy and through embroidered-like imagery, to tell the story of Rose, a woman who moves from Ivory to the Parisian suburbs with her two young sons. Spanning 20 years from their arrival in France, Leonor Serraille’s follow-up to her Camera d’Or-winner Jeune Femme (Cannes 2017) is the moving chronicle of the construction and deconstruction of a family. A poetic elegy on coming-of-age as an unearthly process, is at the same time a sensitive and complex inspection of the imaginary boundary between childhood and adulthood, innocence and experience – led by a superb female performance and vibrating with emotion and an invincible sense of freedom."
Eve | Εύα,/en/movie-tiff/movie/14698,"During her summer vacation, a married woman, Eve, meets a young man with whom she lives a brief love affair, provoking her husband's rage and the censure of the island's small community."
Reconstruction | Αναπαράσταση,/en/movie-tiff/movie/14691,"After years of working in Germany as an immigrant, a man returns to his village of Tymfea, in Epirus: a handful of stone houses in a desolate, rugged part of Greece, depopulated by many years of immigration and home to the few remaining inhabitants. A few days later, his wife, with the help of her lover, kills him, buries him in the garden, and tells everyone that he has gone back to Germany. The man’s sudden departure makes the villagers suspicious and soon the police arrive. That is the crux of the story that will develop through different investigations: the one conducted by the bureaucracy (the examining magistrate) which wants to find a perpetrator and close the case; and the one conducted by a group of journalists, which by recording the testimonials of the villagers, highlights the sociological framework that generated these events, as well as the dramatic social reality of the village which remains an open wound."
A E I O U – A Quick Alphabet of Love | A E I O U – Das schnelle Alphabet der Liebe,/en/movie-tiff/movie/14474,"An actress is mugged in front of a trendy bar in West Berlin. Barging into her, a young man takes her handbag and runs off into the night. A short while later, they meet again. Anna (Sophie Rois) and Adrian (Milan Herms). This time she is his teacher and is supposed to improve his speaking skills. Adrian is an orphan and considered a “difficult case.” Anna is an actress but hasn't been working for a while. Both have strayed from their path and don’t quite fit in. She thought it would never happen to her again. He didn’t even know such a thing existed. A woman, a boy, and another impossible love story."
A Ballad | Balada,/en/movie-tiff/movie/14569,"A Ballad follows 30-year-old unambitious Meri, a housewife and a mother of an 8-year-old girl Mila, whose 14 years older husband Hasan throws her out of their home in a fit of jealous rage. After returning to her parents’ home without her daughter, whom Hasan decided to keep, Meri realizes she is trapped in a wicked circle of provincial laws and rules, and her family’s needs and ambitions. Trying to find herself, Meri auditions for a film that is to be shot in the neighborhood. Adapted from a famous South Slavic folk ballad, this optimistic exploration of love, freedom, and art, renders in cinema the tumbling pathos of a slow, emotive song. Through the rhythmical transition between realistic sequences and more experimental interludes, and from comical confrontations to moments of contemplation, the film invites us to follow the pace of a beating heart."
The Volunteer | La Voluntaria,/en/movie-tiff/movie/14716,"Marisa Sola, a 65-year-old doctor that just retired, is dying to have her own grandchildren, but for some inexplicable reason none of her children has granted her this satisfaction. After a heated argument during a family dinner, Marisa decides to leave everything and travel to a refugee camp in Greece, where she believes the children need people just like her. Upon her arrival, she discovers a reality that she could never have imagined and which leads her to explore the boundaries between love and the need to feel useful... An insightful view into the human landscape of disaster caused by forced movement, questioning the power game between intruding gazes and the possibility to remain an external observer in the face of a humanitarian crisis."
Tori and Lokita | Tori et Lokita,/en/movie-tiff/movie/14679,"In Belgium today, a young boy and an adolescent girl who have travelled alone from Africa pit their invincible friendship against the difficult conditions of their exile."
Under the Lake | Under the Lake,/en/movie-tiff/movie/14647,"As a mountainous village in Greece sinks under the lake, the memories of its inhabitants emerge from the water."
Empire of Light | Empire of Light,/en/movie-tiff/movie/14722,"Academy-Award-winner Sam Mendes brings to focus the boundless energy of the late 70s and early 80s, a time of great political upheaval and a creative period for music and culture in the UK. Empire of Light feels like a love letter to seventh art, and the story follows two employees of an English coast cinema, Hilary and Stephen, who find refuge in each other. Mendes hand-picks the songs of his film, such as “Too Much Too Young” by The Specials and “Mirror in the Bathroom” by The Beat or “Love Will Tear Us Apart” by Joy Division and “Spellbound” by Siouxsie and the Banshees. The result is an emotional ode to music and cinema, a personal film that evokes a “golden” past, without, however overlooking the larger social issues of the time."
Emily the Criminal,/en/movie-tiff/movie/14471,"Emily is saddled with student debt and locked out of the job market due to a minor criminal record. Desperate for income, she takes a shady gig as a “dummy shopper,” buying goods with stolen credit cards supplied by a middleman named Youcef. Faced with a series of dead-end job interviews, Emily soon finds herself seduced not only by the quick cash and illicit thrills of black market capitalism, but also by her ardent mentor Youcef."
"Luxembourg, Luxembourg",/en/movie-tiff/movie/14578,"There are many beautiful places to die. Luxembourg is not one of them. But beautiful or not, Luxembourg makes dying very expensive. When twin brothers hear that their long-absent father is sick in Luxembourg, they set out on a journey from Ukraine to Central Europe to see him one last time. Will the man they find be the bad-ass dad they remember?"
Nightsiren | Svetlonoc,/en/movie-tiff/movie/14570,"A young woman returns to her native mountain village, searching for answers about her troubled childhood, but as she tries to uncover the truth, ancient legends begin to invade modern reality, leading the villagers to accuse her of witchcraft and murder. Αddressing the resurgence of ancient beliefs in modern-day Slovakia and how issues such as misogyny, xenophobia, and mass hysteria still prevail in our modern world, this is a captivating story of what it takes to be free when we choose to step off the beaten path, made by a courageous woman filmmaker previously devoted in negotiating the boundaries of reality through documentary film."
Phantom Project | Proyecto fantasma,/en/movie-tiff/movie/14466,"Pablo is a young actor who dreams of staring at a film. Still, in order to make ends meet he has to work as a simulated patient in medical schools and weird sessions of alternative therapies. But it's not only his career that becomes stuck; his life also seems to be spiraling, as he is still in love with his successful ex-boyfriend, while his roommate disappeared without paying the rent, leaving behind several problems – among them... a ghost. This is the start of Pablo's journey through an unassuming neighborhood of Santiago de Chile, meeting new friends and allies, and finding out that the path to fulfilling his dreams will be more tangled and stranger than he thought. Filmed in early 2021, when pandemic restrictions were still in full force in Chile, and drawing on the filmmaker’s personal experiences and references, this twisted comedy provides a new definition of the “indie” genre, with dramatic and spooky moments alternating with scenes of pure millennial introspection."
A Piece of Sky | Drii Winter,/en/movie-tiff/movie/14477,"In a remote Alpine village isolated from the outside world, young love is put to the test. Anna comes from the village and has a daughter from an earlier relationship, while Marco is an outsider from the flatlands hired by the mountain farmers to work the rugged land. Together they experience the joy of new love and the closeness of family. But when Marco suddenly starts losing control over his impulses and behaving erratically, a new tension rises in the community. Through the changing seasons and the harshness of life, Anna fights to preserve a love she believes can outshine even death."
Safe Place | Sigurno Mjestro,/en/movie-tiff/movie/14536,"A traumatic event – a suicide attempt – creates a rift in the family’s everyday life. Their lives fundamentally change, as if they are waging a war invisible to everyone else. The source of the story is autobiographical, it is addressed in the film and highlighted by the fact that the author/director plays himself."
The Engagement | Τ’ αρραβωνιάσματα,/en/movie-tiff/movie/14577,A young couple’s romance comes to a tragic end when they learn that they are siblings.
Piaffe | Piaffe,/en/movie-tiff/movie/14554,"When her sibling Zara (played by a non-binary artist) suffers a nervous breakdown, the introvert Eva is forced to take on Zara’s job as a foley artist. She struggles to create sounds for a commercial featuring a horse, when a horsetail grows out of her body. Empowered by this change in her body, she lures a botanist into an affair, through a game of submission. A visceral journey into control, gender, and artifice, the sensational debut feature of a visual artist introduces the genre of ""body pleasure."" Shot in a textured, luscious 16mm film, and treating the sound design with warm meticulousness, this is a prime example of cinema that triggers, foreplay, climax, and all sorts of petit morts."
Plan 75,/en/movie-tiff/movie/14497,"In Japan, government program Plan 75 encourages senior citizens to be voluntarily euthanized to remedy a super-aged society. An elderly woman whose means of survival are vanishing, a pragmatic Plan 75 salesman, and a young Filipino laborer face choices of life and death. A quietly subversive yet chilling look at a callous future society, unveiling the beauty and dignity of human life behind the benevolent facade."
The Ordinaries,/en/movie-tiff/movie/14690,"In a repressive three class-society, Paula, a simple Supporting Character, is about to face the most important test of her life: she has to prove she deserves to be a Lead. She is at the top of her class at the Main Character School – but so far has failed in generating great emotional music. In search of a solution, she finds herself in the abyss of the cinematic world, on the fringes of the storyline, and lost amongst the Outtakes."
Dirty Difficult Dangerous,/en/movie-tiff/movie/14571,"Roaming the streets of Beirut searching for metal objects to be recycled, Ahmed, a Syrian refugee, thought he’d find love with Mehdia, an Ethiopian domestic. But in this city, such a story seems almost impossible. Will this couple be able to find the way to the freedom given that Ahmed suffers a mysterious illness that slowly turns his body into metal?"
Three | Tri,/en/movie-tiff/movie/14564,"Three stories unfold in Yugoslavia in the beginning, the middle, and the end of World War II. The connecting link is the main protagonist, who is involved in a violent act as an eye-witness, an offender and a victim, respectively. Nominated for the Best Foreign Language Film Academy Award and arguably the best Partizan film of Yugoslavian cinema, Aleksandar Petroviċ's anti-war drama is an allusive and masterfully directed film about death and the common people shattered by the grinding wheels of war."
Octopus Skin | La Piel Pulpo,/en/movie-tiff/movie/14701,"Seventeen-year-old twins Iris and Ariel live with their mother and older sister Lía on a rocky island full of mollusks and reptiles. The adolescents have grown up isolated from the continent, in a fraternal relationship exceeding the limits of normal intimacy between siblings and in transcendental connection with nature. Following months caught up in a love-hate relationship with her children, their mother commits suicide. Her sudden death deeply affects the siblings and Iris, driven by a strong need to get away from her brother, decides to go to the city alone for the first time. A film that seems made by the four elements of matter invites us to a secluded psychological and natural landscape, reminding us (in the words of John Dunne) that “no man is an island.”"
To Each Their Voice: Theo Angelopoulos & Nikos Panayotopoulos | Θόδωρος Αγγελόπουλος – Νίκος Παναγιωτόπουλος: Ο καθένας και η μουσική του,/en/movie-tiff/movie/14717,"In the mid-80s, Aegokeros publishing house intended, although without success, to publish a magazine themed around film and the theater. The main topic of each issue would be a conversation (in the form of an interview) between two auteurs, either of cinema or theater. Theo Angelopoulos and Nikos Panayotopoulos were chosen by the editorial board for the first issue. The two of them were indisputably the key figures of Greek cinema at the time, and they were also placed among the pioneers of New Greek Cinema. In this context, Antonis Kokkinos and Yannis Soldatos recorded a three-hour interview between Theo and Nikos, on a summer evening at Angelopoulos’s house in the area of Mati, by the sea of Attica. The interview brought to the fore their shared trajectory, but also the different routes they followed from one point onwards, starting from their years in Paris and moving to their spectacularly failed attempt to prepare Angelopoulos’s first film – In the short film The Forminx, Panayotopoulos worked as an assistant director. Thirty-five years later, this previously unreleased conversation was traced in-between tapes and transcripts! Given that the two protagonists have passed away, this conversation stands as a valuable piece of documentation of the creators’ perspective on their own work (both the existing and the future), as well as a thorough insight into New Greek Cinema and world cinema by and large."
Dodo | Dodo,/en/movie-tiff/movie/14620,"A dodo, a bird extinct for the last 300 years, shows up at the villa of a formerly wealthy family in Athens. The owners are counting down the critical two days to their daughter’s wedding, which will bring their financial salvation. In Dodo’s presence, the already thin line between sanity and madness collapses as the situation spins out of control."
Return to Dust | Yin Ru Chen Yan,/en/movie-tiff/movie/14713,"Time is essential in both cinema and farming according to director Li Ruijun, who returns to his familiar hometown in rural China to tell the story of Ma and Cao, two lonely middle-aged people who are pushed into an arranged marriage. Faced with the adversity of nature and farm life, the couple seeks to understand the Earth’s cycles and find harmony in the ever-changing challenges of the farming process, as their own bond begins to blossom. Ruijun brings to the screen the virtues and simple pleasures of a traditional way of rural life, in a graceful, subtle, and soulful film that poetically underscores the bond between humans and the land in a fast-changing China."
Cloves & Carnations | Bir Tutam Karanfil,/en/movie-tiff/movie/14493,"In the snowy and desolate roads of South Eastern Anatolia. An elderly refugee carries the corpse of his deceased wife to their homeland, with his 12-year-old granddaughter still carrying the trauma of war... Their journey becomes more difficult as they get closer to the border of a country at war. Once they get caught up by the police, their ways separate into three different destinations. Embarking from the conviction that we are all immigrants in this world, as we somehow came here and we will soon have to go back, this beautifully crafted film about the journey and rituals of loss and mourning asks persistently a burning question. After all, what are the things we carry?"
Ioanna | Ioanna,/en/movie-tiff/movie/14542,"Ioanna cleans fish on a lonely island, and only dreams of an old love from Germany. Apart from her memories of him, she has nothing but a faded postcard. The longing makes her travel. Penniless, she moves through a ramshackle Europe. A bear finds the sleeping Ioanna. And Ioanna, who has been mute until now, finds her voice again."
Leonor Will Never Die,/en/movie-tiff/movie/14473,"Leonor Reyes was once a major player in the Filipino film industry after creating a string of successful action films, but now her household struggles to pay the bills. When she reads an advertisement looking for screenplays, Leonor begins tinkering with an unfinished script about the quest of young, noble Ronwaldo, forced to avenge his brother’s murder at the hand of thugs. While her imagination provides some escape from reality, she goes all-in after an accident involving a television knocks her out, sends her into a coma, and transports her inside the incomplete movie. Now Leonor can play out her wildest dreams firsthand and discover the perfect ending to her story. With her feature film debut, a newcomer director expresses a joyous love for cinema through the film’s irreverent form and the wide-eyed, endearing lead performance. Ramirez Escobar concocts a winning mixture of zany misadventures, awesome period re-creations, and self-reflective storytelling while grounding the story in the genuine emotions of a family suddenly torn apart."
The Listener,/en/movie-tiff/movie/14719,"Steve Buscemi returns to directing with a phone-based drama where Beth, a helpline volunteer, spends endless nights listening to the thoughts and feelings of the lonely, broken, hopeless and worried. Conceived during the peak of the recent pandemic, the film's premise recalls the loneliness and social breakdown of the time of covid isolation while Tessa Thompson’s mesmerizing performance brings to life the “other side” of a help hotline, the daily – and nightly – routine and personal challenges of a social worker."
Palm Trees and Power Lines | Palm Trees and Power Lines,/en/movie-tiff/movie/14673,"Seventeen-year-old Lea spends her summer break aimlessly tanning in her backyard with her best friend, tiptoeing around her needy mother, and getting stoned with a group of boys from school. This monotony is interrupted by a chance encounter with Tom, an older man who promises an alternative to Lea’s unsatisfying adolescent life. But as things progress between them, red flags about Tom’s life begin to surface, and Lea chooses to ignore them. Under Tom’s influence, Lea begins to see her mom as unfit and her friends as a waste of her time. Isolated from those around her, Lea discovers Tom’s true intentions and finds herself in a situation that she never could have imagined."
The Strange Case of Jacky Caillou | Jacky Caillou,/en/movie-tiff/movie/14684,"Small village, high in the French Alps, today. Jacky Caillou lives with his loving grandmother Gisele, a magnetic healer respected by all. Elsa, a young woman comes from the city to consult: a strange hairy dark stain grows on her back… When the village starts to suffer herd killings, and his grandmother pass away, Jacky urgently needs to understand if he inherited the ancestral gift. Will he manage to save both Elsa and his village?"
